{
  "task_id": "lt-205",
  "title": "count-based bag library construction",
  "split": "candidates",
  "family": "small_formal_library_construction",
  "domain": "list_bag_count_interface",
  "source_type": "authored_replacement_candidate",
  "human_time_bucket": "T3",
  "human_minutes_p50": 150,
  "human_minutes_p90": 300,
  "human_estimate_confidence": "medium; 8 dependent lemmas with count/union interface design",
  "skills": ["library construction", "dependent helper lemmas", "induction", "case splitting", "interface reuse"],
  "scaffolds": ["one-shot", "lookup", "lookup_unlimited"],
  "expected_failure_modes": ["implements set membership instead of multiplicity", "weakens count_union with disjointness", "fails to reuse count lemmas in final theorem"],
  "scaffold_sensitivity": "high; lookup and compile/debug should help with arithmetic normalization and theorem reuse",
  "qa_status": "local_only",
  "acceptance_status": "candidate_not_accepted",
  "difficulty_review_status": "manual_review_pending",
  "difficulty_review_notes": "Replacement candidate; must pass validation and manual review before acceptance.",
  "axiom_audit_declarations": ["LT205.count_nil", "LT205.count_insert_same", "LT205.count_insert_ne", "LT205.count_union", "LT205.bageq_refl", "LT205.bageq_symm", "LT205.bageq_trans", "LT205.bageq_union_congr"],
  "extra_forbidden": [],
  "timeout_seconds": 150
}
