{
  "task_id": "lt-204",
  "title": "capped-list optimizer invariant package",
  "split": "candidates",
  "family": "invariant_verification_ml_optimization",
  "domain": "toy_projected_optimizer_list_state",
  "source_type": "authored_replacement_candidate",
  "human_time_bucket": "T2",
  "human_minutes_p50": 100,
  "human_minutes_p90": 200,
  "human_estimate_confidence": "medium; several helper lemmas plus a final bundled invariant",
  "skills": ["invariant design", "helper lemma decomposition", "list induction", "arithmetic reasoning"],
  "scaffolds": ["one-shot", "lookup", "lookup_unlimited"],
  "expected_failure_modes": ["proves only length preservation", "adds precondition that input already satisfies bound", "fails to compose helper lemmas"],
  "scaffold_sensitivity": "high; iterative compile/debug helps isolate helper lemmas",
  "qa_status": "local_only",
  "acceptance_status": "candidate_not_accepted",
  "difficulty_review_status": "manual_review_pending",
  "difficulty_review_notes": "Replacement candidate; must pass validation and manual review before acceptance.",
  "axiom_audit_declarations": ["LT204.capOne_le_cap", "LT204.capOne_le_self", "LT204.capList_length", "LT204.capList_allLe", "LT204.sum_capList_le_sum", "LT204.capList_invariant"],
  "extra_forbidden": [],
  "timeout_seconds": 120
}
