{
    "task_id":  "lt-105",
    "title":  "counter batched increment proof repair",
    "split":  "test",
    "family":  "proof_repair_codebase",
    "domain":  "small_counter_api_change",
    "source_type":  "authored",
    "human_time_bucket":  "T2",
    "human_minutes_p50":  55,
    "human_minutes_p90":  110,
    "human_estimate_confidence":  "medium; requires accumulator-style codebase repair and arithmetic re-association",
    "skills":  [
                   "codebase navigation",
                   "recursive proof repair",
                   "sum specification",
                   "arithmetic normalization"
               ],
    "scaffolds":  [
                      "one-shot",
                      "lookup",
                      "lookup_unlimited"
                  ],
    "expected_failure_modes":  [
                                   "handles only singleton increments",
                                   "wrong sum order",
                                   "misses generalized counter induction"
                               ],
    "scaffold_sensitivity":  "medium_to_high; iterative compile/debug helps align recursive equation and sum algebra",
    "qa_status":  "local_only",
    "axiom_audit_declarations":  [
                                     "LT105.value_incBy",
                                     "LT105.value_incAll"
                                 ],
    "extra_forbidden":  [

                        ],
    "timeout_seconds":  60,
    "acceptance_status":  "candidate_not_accepted",
    "difficulty_review_status":  "audited_downgraded",
    "difficulty_review_notes":  "candidate_borderline: recursive API repair, still mostly induction+simp"
}
