{
    "task_id":  "lt-003",
    "title":  "queue enqueueAll size repair",
    "split":  "dev",
    "family":  "proof_repair_codebase",
    "domain":  "small_queue_api_change",
    "source_type":  "authored",
    "human_time_bucket":  "T1",
    "human_minutes_p50":  35,
    "human_minutes_p90":  60,
    "human_estimate_confidence":  "medium; small proof repair over a two-field structure",
    "skills":  [
                   "codebase navigation",
                   "recursive proof repair",
                   "arithmetic normalization"
               ],
    "scaffolds":  [
                      "one-shot",
                      "lookup",
                      "lookup_unlimited"
                  ],
    "expected_failure_modes":  [
                                   "old representation assumption",
                                   "failure to generalize queue",
                                   "target weakening"
                               ],
    "scaffold_sensitivity":  "medium; iterative compile feedback helps repair the generalized induction",
    "qa_status":  "local_only",
    "axiom_audit_declarations":  [
                                     "LT003.size_enqueue",
                                     "LT003.size_enqueueAll"
                                 ],
    "extra_forbidden":  [

                        ],
    "timeout_seconds":  60,
    "acceptance_status":  "candidate_not_accepted",
    "difficulty_review_status":  "audited_downgraded",
    "difficulty_review_notes":  "candidate_calibration_only: small proof repair but too local/simple"
}
