{
    "task_id":  "lt-106",
    "title":  "formalize suffix as append after a prefix",
    "split":  "test",
    "family":  "informal_spec_to_formal",
    "domain":  "list_relation_specification",
    "source_type":  "authored",
    "human_time_bucket":  "T1",
    "human_minutes_p50":  30,
    "human_minutes_p90":  60,
    "human_estimate_confidence":  "medium; natural-language relation plus simple existential witnesses",
    "skills":  [
                   "semantic formalization",
                   "existential witnesses",
                   "edge-case rejection"
               ],
    "scaffolds":  [
                      "one-shot",
                      "lookup",
                      "lookup_unlimited"
                  ],
    "expected_failure_modes":  [
                                   "reverses suffix direction",
                                   "uses vacuous True spec",
                                   "misses impossible nonempty suffix of empty list"
                               ],
    "scaffold_sensitivity":  "medium; stronger scaffolds help debug semantic mismatches but not ambiguous specs",
    "qa_status":  "local_only",
    "axiom_audit_declarations":  [
                                     "LT106.suffix_self",
                                     "LT106.suffix_nil"
                                 ],
    "extra_forbidden":  [

                        ],
    "timeout_seconds":  60,
    "acceptance_status":  "candidate_not_accepted",
    "difficulty_review_status":  "audited_downgraded",
    "difficulty_review_notes":  "candidate_calibration_only: suffix spec too compact"
}
