{
  "task_id": "lt-202",
  "title": "Mathlib set image/preimage package",
  "split": "candidates",
  "family": "direct_theorem_proving",
  "domain": "mathlib_set_image_preimage",
  "source_type": "authored_replacement_candidate",
  "human_time_bucket": "T2",
  "human_minutes_p50": 90,
  "human_minutes_p90": 180,
  "human_estimate_confidence": "medium; requires Mathlib set notation, injective/surjective witness construction, and set extensionality",
  "skills": ["Mathlib API search", "set extensionality", "premise selection", "theorem decomposition"],
  "scaffolds": ["one-shot", "lookup", "lookup_unlimited"],
  "expected_failure_modes": ["forgets surjectivity direction", "misuses image/preimage notation", "adds extra premise to weakened theorem", "cannot merge image witnesses under injectivity"],
  "scaffold_sensitivity": "high; lookup should materially help with Set.image membership and subset_antisymm",
  "qa_status": "local_only",
  "acceptance_status": "candidate_not_accepted",
  "difficulty_review_status": "manual_review_pending",
  "difficulty_review_notes": "Replacement candidate; must pass validation and manual review before acceptance.",
  "axiom_audit_declarations": ["LT202.subset_preimage_image", "LT202.image_preimage_subset", "LT202.preimage_image_eq_of_injective", "LT202.image_inter_eq_of_injective", "LT202.image_preimage_eq_of_surjective"],
  "extra_forbidden": [],
  "timeout_seconds": 120
}
